speaker_id,slide_id,question_id,problem_id,text
PK,,,," …z mykologami. Do tych aplikacji trzeba ładować dane z wiarygodnych źródeł. Trzeba takie badania jak nasze prowadzić wśród szerokich kręgów specjalistów, ponieważ tu chodzi o potężną odpowiedzialność, także za ludzkie zdrowie i życie i szerzenie wiedzy o grzybach. Popularyzacja jej w Polsce jest zagadnieniem kluczowym, ponieważ w Polsce bardzo dużo ludzi grzyby zbiera i spożywa."
PK_DE_03,,,,Dokładnie.
PK,,,," Więc w naszym kraju, w odróżnieniu od innych, wiedza solidna, wiarygodna i odpowiedzialnie podana na temat grzybów dziko rosnących, to jest sprawa zdrowia publicznego. I gra się otoczy o to, żeby dzieci nie umierały po zatruciach muchomorem zielonawym, żeby ludzie nie jedli olszówek, bo ich pradziadowie jadali."
PK_DE_03,,,,"Pani mówi [muchomor zielonawy], jak mi się podoba, wie pani, ile ja walczę… świętej pamięci profesor Wojewoda, no nie wiem, już 12 lat chyba nie żyje, w każdym bądź razie nazwał to... zaproponował, a do tej pory nawet nie jest to jeszcze tak poparte, gdzie samo nazwanie tego grzyba muchomorem zielonawym sprawia, że normalnie każdy wie, że on jest zielonawy. Ludzie często widzą muchomora czerwonego i oni mówią, że o, to sromotnik dla teściowej i tak dalej. Jeżeli by ta nazwa była priorytetem w mediach. Dalej jest muchomor sromotnikowy i później efekty są takie, że w Gazecie na przykład Wyborczej parę lat temu o sromotniku, to sobie gościu pomylił sromotnika bezwstydnego, tego fallusa, ze sromotnikiem. Po co? Ja rozumiem, że ludzie starzy już wiedzą: sromotnik, no to się przyjęło, ale zamiast wprowadzać nowe nazwy, to nawet sanepidy z uporem maniaka dalej… dalej po prostu dla nich jest muchomor sromotnikowy. I ludzie nie wiedzą, że… on jaki ma kolor, bo często myślą, że to ten czerwony. No."
PK,,,," To jest niezwykle istotne, co pan powiedział, także dla mnie osobiście i w naszej dyscyplinie, bo to chodzi o informacje, o to, że trzeba ludziom podawać informację taką, która im najszybciej w pamięci utkwi, prawda? "
PK_DE_03,,,,"No aktualną, nie po to świętej pamięci profesor wziął to uczulił, zmienił tą nazwę na zielonawy, żeby każdy wiedział, że trzeba uważać na te grzyby, które mają zielony kolor, zielonkawy. A nie sromotnikowy, no sromotnik no to srom, nie, wiadomo, o co chodzi, a często, jak mówię, nawet były przykłady, że pokazywali sromotnika bezwstydnego i podpis, że jest trujący, a wręcz przeciwnie, jest jadalny i nawet leczniczy."
PK,,,," Tak. Bardzo serdecznie panu dziękuję. Myślę, że tutaj możemy zatrzymać nagranie, jeśli pan pozwoli jeszcze się nie żegnam, tylko na razie wyłączę nagranie, dobrze?"
PK_DE_03,,,,Zatrzymano transkrypcję
